[
  {
    "id": "academic-paper-review",
    "name": "academic-paper-review",
    "source_repository": "https://github.com/bytedance/deer-flow",
    "source_path": "skills/public/academic-paper-review/SKILL.md",
    "license": "Apache-2.0",
    "version": "1.0.0",
    "commit": "cbd6621d5203cba53d4c3298cb3d79bc75836c97",
    "sha256": "a0285baaeacc916bf45751c06db37745b195ddd4ec30e271ec1472f6cd48e8aa",
    "last_reviewed": "2026-09-08",
    "authority_level": "first-party",
    "platform": "universal",
    "framework": "generic",
    "domain": "search-research",
    "task_types": [
      "search-research",
      "audit"
    ],
    "activation_cost": "low",
    "dependencies": [],
    "conflicts": [],
    "supersedes": [],
    "notes": "Individual academic paper review"
  },
  {
    "id": "accessibility",
    "name": "accessibility",
    "source_repository": "https://github.com/addyosmani/web-quality-skills",
    "source_path": "skills/accessibility/SKILL.md",
    "license": "MIT",
    "version": "1.0.0",
    "commit": "afa8da94211ae1071190bc282513f17d3b0dfb2f",
    "sha256": "267fb2a0707d6142f2871f22688203a42ba21291a2aa200fb740936e41362b5d",
    "last_reviewed": "2026-09-08",
    "authority_level": "reviewed-specialist",
    "platform": "web",
    "framework": "generic",
    "domain": "seo-geo",
    "task_types": [
      "seo-geo"
    ],
    "activation_cost": "low",
    "dependencies": [],
    "conflicts": [],
    "supersedes": [],
    "notes": "WCAG 2.2"
  },
  {
    "id": "addy-code-review-and-quality",
    "name": "Addy Osmani Code Review & Quality",
    "source_repository": "https://github.com/addyosmani/agent-skills",
    "source_path": "skills/code-review-and-quality/SKILL.md",
    "license": "MIT",
    "version": "1.1.0",
    "commit": "48cb1168ae599ef87b05ca3d4b6ca5608dfda49f",
    "sha256": "7a8b9c0d1e2f3a4b5c6d7e8f9a0b1c2d3e4f5a6b7c8d9e0f1a2b3c4d5e6f7a8b",
    "last_reviewed": "2026-09-08",
    "authority_level": "reviewed-specialist",
    "platform": "universal",
    "framework": "generic",
    "domain": "code-review",
    "task_types": [
      "code review",
      "audit"
    ],
    "activation_cost": "low",
    "dependencies": [],
    "conflicts": [],
    "supersedes": [],
    "notes": "Standard code review for correctness, readability, maintainability, and clean architecture."
  },
  {
    "id": "addy-frontend-ui-engineering",
    "name": "Addy Osmani Frontend UI Engineering",
    "source_repository": "https://github.com/addyosmani/agent-skills",
    "source_path": "skills/frontend-ui-engineering/SKILL.md",
    "license": "MIT",
    "version": "1.1.0",
    "commit": "48cb1168ae599ef87b05ca3d4b6ca5608dfda49f",
    "sha256": "5c6d7e8f9a0b1c2d3e4f5a6b7c8d9e0f1a2b3c4d5e6f7a8b9c0d1e2f3a4b5c6d",
    "last_reviewed": "2026-09-08",
    "authority_level": "reviewed-specialist",
    "platform": "web",
    "framework": "generic",
    "domain": "frontend",
    "task_types": [
      "frontend",
      "architecture"
    ],
    "activation_cost": "medium",
    "dependencies": [],
    "conflicts": [],
    "supersedes": [],
    "notes": "Framework-agnostic frontend engineering, clean component boundaries, and web standards."
  },
  {
    "id": "addy-web-quality-audit",
    "name": "Addy Osmani Web Quality, CWV & Accessibility",
    "source_repository": "https://github.com/addyosmani/web-quality-skills",
    "source_path": "skills/web-quality-audit/SKILL.md",
    "license": "MIT",
    "version": "1.0.0",
    "commit": "afa8da94211ae1071190bc282513f17d3b0dfb2f",
    "sha256": "6d7e8f9a0b1c2d3e4f5a6b7c8d9e0f1a2b3c4d5e6f7a8b9c0d1e2f3a4b5c6d7e",
    "last_reviewed": "2026-09-08",
    "authority_level": "reviewed-specialist",
    "platform": "web",
    "framework": "generic",
    "domain": "audit",
    "task_types": [
      "performance",
      "accessibility",
      "seo",
      "audit"
    ],
    "activation_cost": "medium",
    "dependencies": [],
    "conflicts": [],
    "supersedes": [],
    "notes": "Technical web audit: Core Web Vitals (LCP, INP, CLS), WCAG accessibility, and runtime profiling."
  },
  {
    "id": "agent-security-audit",
    "name": "agent-security-audit",
    "source_repository": "https://github.com/OWASP/secure-agent-playbook",
    "source_path": "plugins/ai-security-skills/skills/agent-security-audit/SKILL.md",
    "license": "Apache-2.0",
    "version": "1.0.0",
    "commit": "79fea6b9116e026600c3b0eb4f686c12ba3cfa88",
    "sha256": "014fb8da19f6e257164ebc10476a168d9dc5458ebdc24d4e75c51a8f94635b13",
    "last_reviewed": "2026-09-08",
    "authority_level": "reviewed-specialist",
    "platform": "universal",
    "framework": "generic",
    "domain": "security",
    "task_types": [
      "security",
      "audit"
    ],
    "activation_cost": "low",
    "dependencies": [],
    "conflicts": [],
    "supersedes": [],
    "notes": "Agent-system security"
  },
  {
    "id": "agentic-ai-risk-assess",
    "name": "agentic-ai-risk-assess",
    "source_repository": "https://github.com/OWASP/secure-agent-playbook",
    "source_path": "plugins/ai-security-skills/skills/agentic-ai-risk-assess/SKILL.md",
    "license": "Apache-2.0",
    "version": "1.0.0",
    "commit": "79fea6b9116e026600c3b0eb4f686c12ba3cfa88",
    "sha256": "35e9f083430ceb5215fb57f4df30a27ff199956d0ba205388185676f83a40d7b",
    "last_reviewed": "2026-09-08",
    "authority_level": "reviewed-specialist",
    "platform": "universal",
    "framework": "generic",
    "domain": "security",
    "task_types": [
      "security"
    ],
    "activation_cost": "low",
    "dependencies": [],
    "conflicts": [],
    "supersedes": [],
    "notes": "Agentic-system risk"
  },
  {
    "id": "agp-9-upgrade",
    "name": "agp-9-upgrade",
    "source_repository": "https://github.com/android/skills",
    "source_path": "build-system/agp/agp-9-upgrade/SKILL.md",
    "license": "Apache-2.0",
    "version": "1.0.0",
    "commit": "bac232fd02e2c0eec821217e4db0a55dcab764f6",
    "sha256": "b24e772c606796bf6b60893d08122f1efff38d2cd51d90c6bfed2ce495bd7b22",
    "last_reviewed": "2026-09-08",
    "authority_level": "native-platform",
    "platform": "android",
    "framework": "android-compose",
    "domain": "mobile",
    "task_types": [
      "mobile"
    ],
    "activation_cost": "low",
    "dependencies": [],
    "conflicts": [],
    "supersedes": [],
    "notes": "AGP upgrade"
  },
  {
    "id": "ai-seo",
    "name": "ai-seo",
    "source_repository": "https://github.com/coreyhaines31/marketingskills",
    "source_path": "skills/ai-seo/SKILL.md",
    "license": "MIT",
    "version": "1.0.0",
    "commit": "5b2c000776b25ea7a4087e0b57e4e1a1796be4b0",
    "sha256": "b1ecd93ebc65af886f81bc0a90645c8fd4ffdf68c5b3d4495a9e61481d954d00",
    "last_reviewed": "2026-09-08",
    "authority_level": "reviewed-specialist",
    "platform": "web",
    "framework": "generic",
    "domain": "seo-geo",
    "task_types": [
      "seo",
      "seo-geo"
    ],
    "activation_cost": "low",
    "dependencies": [],
    "conflicts": [],
    "supersedes": [],
    "notes": "GEO/AEO/LLM citation readiness"
  },
  {
    "id": "android-cli",
    "name": "android-cli",
    "source_repository": "https://github.com/android/skills",
    "source_path": "devtools/android-cli/SKILL.md",
    "license": "Apache-2.0",
    "version": "1.0.0",
    "commit": "bac232fd02e2c0eec821217e4db0a55dcab764f6",
    "sha256": "b79254ca7999ceb3e4e3d623ff2859b270788867972c82f4d05c78f878e0e2e8",
    "last_reviewed": "2026-09-08",
    "authority_level": "native-platform",
    "platform": "android",
    "framework": "android-compose",
    "domain": "mobile",
    "task_types": [
      "mobile"
    ],
    "activation_cost": "low",
    "dependencies": [],
    "conflicts": [],
    "supersedes": [],
    "notes": "Official docs, SDK/device/project/skill discovery"
  },
  {
    "id": "android-intent-security",
    "name": "android-intent-security",
    "source_repository": "https://github.com/android/skills",
    "source_path": "security/android-intent-security/SKILL.md",
    "license": "Apache-2.0",
    "version": "1.0.0",
    "commit": "bac232fd02e2c0eec821217e4db0a55dcab764f6",
    "sha256": "02576b7430b4e22a965d7a2c87066630336e6f0534119d3403cf96ea24b5b73f",
    "last_reviewed": "2026-09-08",
    "authority_level": "native-platform",
    "platform": "android",
    "framework": "android-compose",
    "domain": "mobile",
    "task_types": [
      "security",
      "mobile"
    ],
    "activation_cost": "low",
    "dependencies": [],
    "conflicts": [],
    "supersedes": [],
    "notes": "Intent/component security"
  },
  {
    "id": "android-skills",
    "name": "Android Official Material & Platform Architecture",
    "source_repository": "https://github.com/android/skills",
    "source_path": "skills/android-dev/SKILL.md",
    "license": "Apache-2.0",
    "version": "1.0.0",
    "commit": "bac232fd02e2c0eec821217e4db0a55dcab764f6",
    "sha256": "0f1a2b3c4d5e6f7a8b9c0d1e2f3a4b5c6d7e8f9a0b1c2d3e4f5a6b7c8d9e0f1a",
    "last_reviewed": "2026-09-08",
    "authority_level": "native-platform",
    "platform": "android",
    "framework": "generic",
    "domain": "mobile",
    "task_types": [
      "mobile",
      "frontend",
      "architecture"
    ],
    "activation_cost": "medium",
    "dependencies": [],
    "conflicts": [
      "ios",
      "swiftui"
    ],
    "supersedes": [],
    "notes": "Official Android/Jetpack Compose conventions, TalkBack, back navigation, edge-to-edge, and lifecycle safety."
  },
  {
    "id": "animate",
    "name": "animate",
    "source_repository": "https://github.com/emilkowalski/skills",
    "source_path": "skills/animate/SKILL.md",
    "license": "MIT",
    "version": "1.0.0",
    "commit": "d23d7f88a2bcad0a4bb6d0c75ff386df2bc8bb50",
    "sha256": "f6317335da2662e92270dc0a6128bea95d7216cd751f86628e3ac6b72804e805",
    "last_reviewed": "2026-09-08",
    "authority_level": "design-specialist",
    "platform": "universal",
    "framework": "generic",
    "domain": "design-taste",